{"attestation":{"content_hash":null,"sealed_at":null,"status":"STAGED"},"author":"Queen CiCi","beats":[{"duration_s":20,"id":"beat.pit_stop","lora_context":{"slots":[{"binding":"capsule.boo.lora.map.v1::crew_motion","overlays":["pose_lock_minor_step"],"slot":"gesture"},{"binding":"capsule.boo.lora.map.v1::pitcrew","overlays":["maker_checker_guard"],"slot":"wardrobe"}]},"policy":{"guards":["intent_diffusion","smear_frame"],"maker_checker":"router:queen_boo/checker:queen_cici"},"prompt":{"camera_notes":"Low dolly-in with micro hand bumps; focus rack from crew lead to fuel rig.","continuity":["hero_sf23_number_16","pit_lane_night"],"primary":"Lego Ferrari SF-23 dives into Monza pit lane, crew in vibrant red-yellow suits snapping into position, jittery stop-motion frames, visible studs on tools and tires."},"sequence":0,"telemetry":{"checkpoints":["relay.artifacts.v1::checkpoint.pit_stop"],"hud":["glyph_ping","ritual_caption"]},"title":"Pit Stop Surge"},{"duration_s":20,"id":"beat.podium","lora_context":{"slots":[{"binding":"capsule.boo.lora.map.v1::victory","overlays":["affect_joy"],"slot":"affect"},{"binding":"capsule.boo.lora.map.v1::wrap_voice","overlays":["no_exaggeration"],"slot":"voice"}]},"policy":{"guards":["intent_diffusion"],"maker_checker":"router:queen_boo/checker:queen_cici"},"prompt":{"camera_notes":"Center punch with slow push-in; gentle tilt to reveal confetti fall.","continuity":["hero_sf23_number_16","pit_lane_night"],"primary":"Ferrari driver raises Lego trophy amid brick confetti, glossy helmets reflecting warm light, handheld cadence with exposure drift."},"sequence":3,"telemetry":{"checkpoints":["relay.artifacts.v1::checkpoint.podium"],"hud":["drift_trace","glyph_ping"]},"title":"Brick Podium"},{"duration_s":22,"id":"beat.crash","lora_context":{"slots":[{"binding":"capsule.boo.lora.map.v1::commentary","overlays":["no_sensationalism"],"slot":"voice"},{"binding":"capsule.boo.lora.map.v1::tension","overlays":["affect_alert"],"slot":"affect"}]},"policy":{"guards":["intent_diffusion","smear_frame"],"maker_checker":"router:queen_boo/checker:queen_cici"},"prompt":{"camera_notes":"Dutch angle static; hold fragments mid-air for two-frame beats.","continuity":["monza_banner_tiles","rival_w14_number_44"],"primary":"Lego debris erupts as W14 clips kerb, bricks tumble in deliberate slow staccato, practical light flicker over fragments, tiny camera shake."},"sequence":2,"telemetry":{"checkpoints":["relay.artifacts.v1::checkpoint.crash"],"hud":["glyph_ping","ritual_caption"]},"title":"Brick Scatter"},{"duration_s":22,"id":"beat.overtake","lora_context":{"slots":[{"binding":"capsule.boo.lora.map.v1::crowd_energy","overlays":["affect_resolve"],"slot":"affect"},{"binding":"capsule.boo.lora.map.v1::driver_energy","overlays":["drift_variance_low"],"slot":"gesture"}]},"policy":{"guards":["smear_frame"],"maker_checker":"router:queen_boo/checker:queen_cici"},"prompt":{"camera_notes":"Lateral tracking on slider; hold hero car in third-frame composition.","continuity":["hero_sf23_number_16","rival_w14_number_44"],"primary":"Ferrari SF-23 lunges past Mercedes W14 on Lego Monza straight, shallow depth of field, lateral whip with stop-motion stutter, studded asphalt track glinting."},"sequence":1,"telemetry":{"checkpoints":["relay.artifacts.v1::checkpoint.overtake"],"hud":["drift_trace","glyph_ping"]},"title":"Main Straight Overtake"}],"bindings":{"lora_map":"capsule.boo.lora.map.v1","previz":"sol.f1.previz.v1","registry":"capsule.registry.runtime.v1","routing_policy":"capsule.gpt.intent.routing.v1","vault":"relay.artifacts.v1","wrapper":"capsule.wrapper.adaptco_os.v1"},"capsule_id":"capsule.prompt.graph.lego_f1.sf23_vs_w14.v1","continuity":{"overlays":{"audio":["crowd_swell","servo_clicks"],"telemetry":["drift_trace","glyph_ping"]},"tokens":["hero_sf23_number_16","monza_banner_tiles","pit_lane_night","rival_w14_number_44"]},"description":"Prompt graph for a 90-second Lego F1 highlight reel staged around the Ferrari SF-23 and Mercedes W14 liveries with stop-motion cadence.","global_style":{"cadence":"Simulate 12 fps stop-motion with deliberate frame holds and intermittent double exposures for human jitter.","camera":"Tripod grammar with handheld bumps, shallow depth pulls, and slight lens breathing on whip transitions.","lighting":"Practical pit lane lighting with subtle tungsten-to-daylight drift and diegetic flicker.","material":"ABS plastic with visible studs, mold seams, and hard specular roll-off across curved bricks."},"issued_at":"2025-09-24T22:40:00Z","post_processing":{"audio":"Blend brick clicks, servo whirs, restrained commentary, and night crowd murmur.","cadence":"Hold or drop frames to maintain 12 fps rhythm before final encode.","flicker":"Layer subtle 1.5% exposure oscillation and 150K color temperature drift per 12 frames.","jitter_px":[0.5,1.5]},"quality":{"checks":[{"description":"Apply irregular frame holds to avoid CG smoothness and respect human jitter.","id":"motion_stutter","tolerance":">= 1 hold per 6 frames"},{"description":"Apply vignette and focus breathing to each beat transition for tactile optics.","id":"lens_character","tolerance":"applied per beat"},{"description":"Ensure studs and mold seams remain legible in every hero frame.","id":"stud_visibility","tolerance":">= 80% frames"},{"description":"Limit per-frame minifig limb travel to maintain Lego stop-motion authenticity.","id":"pose_discipline","tolerance":"<= 6 degrees per frame"}]},"runtime":{"beats":["crash","overtake","pit_stop","podium"],"nominal_fps":12,"total_seconds":90},"subject":{"liveries":{"hero_sf23":{"iconics":["driver_number_16","ferrari_prancing_horse","sf23_sidepods"],"palette":["giallo_modena","nero_opaco","rosso_corsa"]},"rival_w14":{"iconics":["driver_number_44","petronas_stripe","w14_floor"],"palette":["graphite_grey","petronas_teal","silver_halo"]}},"runtime_context":{"beats":["crash","overtake","pit_stop","podium"],"runtime_label":"F1 Brickfilm Highlight","target_duration_s":90},"title":"Monza Night Highlight â€” SF-23 vs W14"},"type":"PromptGraph","version":"1.0.0"}