{
  "capsule_id": "capsule.prompt.graph.lego_f1.sf23_vs_w14.v1",
  "version": "1.0.0",
  "type": "PromptGraph",
  "author": "Queen CiCi",
  "issued_at": "2025-09-24T22:40:00Z",
  "description": "Prompt graph for a 90-second Lego F1 highlight reel staged around the Ferrari SF-23 and Mercedes W14 liveries with stop-motion cadence.",
  "subject": {
    "title": "Monza Night Highlight â€” SF-23 vs W14",
    "runtime_context": {
      "runtime_label": "F1 Brickfilm Highlight",
      "beats": [
        "pit_stop",
        "overtake",
        "crash",
        "podium"
      ],
      "target_duration_s": 90
    },
    "liveries": {
      "hero_sf23": {
        "palette": [
          "rosso_corsa",
          "nero_opaco",
          "giallo_modena"
        ],
        "iconics": [
          "sf23_sidepods",
          "ferrari_prancing_horse",
          "driver_number_16"
        ]
      },
      "rival_w14": {
        "palette": [
          "graphite_grey",
          "petronas_teal",
          "silver_halo"
        ],
        "iconics": [
          "w14_floor",
          "petronas_stripe",
          "driver_number_44"
        ]
      }
    }
  },
  "runtime": {
    "total_seconds": 90,
    "nominal_fps": 12,
    "beats": [
      "pit_stop",
      "overtake",
      "crash",
      "podium"
    ]
  },
  "global_style": {
    "cadence": "Simulate 12 fps stop-motion with deliberate frame holds and intermittent double exposures for human jitter.",
    "material": "ABS plastic with visible studs, mold seams, and hard specular roll-off across curved bricks.",
    "lighting": "Practical pit lane lighting with subtle tungsten-to-daylight drift and diegetic flicker.",
    "camera": "Tripod grammar with handheld bumps, shallow depth pulls, and slight lens breathing on whip transitions."
  },
  "continuity": {
    "tokens": [
      "hero_sf23_number_16",
      "rival_w14_number_44",
      "pit_lane_night",
      "monza_banner_tiles"
    ],
    "overlays": {
      "telemetry": [
        "glyph_ping",
        "drift_trace"
      ],
      "audio": [
        "crowd_swell",
        "servo_clicks"
      ]
    }
  },
  "beats": [
    {
      "id": "beat.pit_stop",
      "title": "Pit Stop Surge",
      "sequence": 0,
      "duration_s": 20,
      "prompt": {
        "primary": "Lego Ferrari SF-23 dives into Monza pit lane, crew in vibrant red-yellow suits snapping into position, jittery stop-motion frames, visible studs on tools and tires.",
        "camera_notes": "Low dolly-in with micro hand bumps; focus rack from crew lead to fuel rig.",
        "continuity": [
          "pit_lane_night",
          "hero_sf23_number_16"
        ]
      },
      "lora_context": {
        "slots": [
          {
            "slot": "wardrobe",
            "binding": "capsule.boo.lora.map.v1::pitcrew",
            "overlays": [
              "maker_checker_guard"
            ]
          },
          {
            "slot": "gesture",
            "binding": "capsule.boo.lora.map.v1::crew_motion",
            "overlays": [
              "pose_lock_minor_step"
            ]
          }
        ]
      },
      "policy": {
        "guards": [
          "intent_diffusion",
          "smear_frame"
        ],
        "maker_checker": "router:queen_boo/checker:queen_cici"
      },
      "telemetry": {
        "checkpoints": [
          "relay.artifacts.v1::checkpoint.pit_stop"
        ],
        "hud": [
          "glyph_ping",
          "ritual_caption"
        ]
      }
    },
    {
      "id": "beat.overtake",
      "title": "Main Straight Overtake",
      "sequence": 1,
      "duration_s": 22,
      "prompt": {
        "primary": "Ferrari SF-23 lunges past Mercedes W14 on Lego Monza straight, shallow depth of field, lateral whip with stop-motion stutter, studded asphalt track glinting.",
        "camera_notes": "Lateral tracking on slider; hold hero car in third-frame composition.",
        "continuity": [
          "hero_sf23_number_16",
          "rival_w14_number_44"
        ]
      },
      "lora_context": {
        "slots": [
          {
            "slot": "gesture",
            "binding": "capsule.boo.lora.map.v1::driver_energy",
            "overlays": [
              "drift_variance_low"
            ]
          },
          {
            "slot": "affect",
            "binding": "capsule.boo.lora.map.v1::crowd_energy",
            "overlays": [
              "affect_resolve"
            ]
          }
        ]
      },
      "policy": {
        "guards": [
          "smear_frame"
        ],
        "maker_checker": "router:queen_boo/checker:queen_cici"
      },
      "telemetry": {
        "checkpoints": [
          "relay.artifacts.v1::checkpoint.overtake"
        ],
        "hud": [
          "glyph_ping",
          "drift_trace"
        ]
      }
    },
    {
      "id": "beat.crash",
      "title": "Brick Scatter",
      "sequence": 2,
      "duration_s": 22,
      "prompt": {
        "primary": "Lego debris erupts as W14 clips kerb, bricks tumble in deliberate slow staccato, practical light flicker over fragments, tiny camera shake.",
        "camera_notes": "Dutch angle static; hold fragments mid-air for two-frame beats.",
        "continuity": [
          "rival_w14_number_44",
          "monza_banner_tiles"
        ]
      },
      "lora_context": {
        "slots": [
          {
            "slot": "affect",
            "binding": "capsule.boo.lora.map.v1::tension",
            "overlays": [
              "affect_alert"
            ]
          },
          {
            "slot": "voice",
            "binding": "capsule.boo.lora.map.v1::commentary",
            "overlays": [
              "no_sensationalism"
            ]
          }
        ]
      },
      "policy": {
        "guards": [
          "intent_diffusion",
          "smear_frame"
        ],
        "maker_checker": "router:queen_boo/checker:queen_cici"
      },
      "telemetry": {
        "checkpoints": [
          "relay.artifacts.v1::checkpoint.crash"
        ],
        "hud": [
          "glyph_ping",
          "ritual_caption"
        ]
      }
    },
    {
      "id": "beat.podium",
      "title": "Brick Podium",
      "sequence": 3,
      "duration_s": 20,
      "prompt": {
        "primary": "Ferrari driver raises Lego trophy amid brick confetti, glossy helmets reflecting warm light, handheld cadence with exposure drift.",
        "camera_notes": "Center punch with slow push-in; gentle tilt to reveal confetti fall.",
        "continuity": [
          "hero_sf23_number_16",
          "pit_lane_night"
        ]
      },
      "lora_context": {
        "slots": [
          {
            "slot": "affect",
            "binding": "capsule.boo.lora.map.v1::victory",
            "overlays": [
              "affect_joy"
            ]
          },
          {
            "slot": "voice",
            "binding": "capsule.boo.lora.map.v1::wrap_voice",
            "overlays": [
              "no_exaggeration"
            ]
          }
        ]
      },
      "policy": {
        "guards": [
          "intent_diffusion"
        ],
        "maker_checker": "router:queen_boo/checker:queen_cici"
      },
      "telemetry": {
        "checkpoints": [
          "relay.artifacts.v1::checkpoint.podium"
        ],
        "hud": [
          "glyph_ping",
          "drift_trace"
        ]
      }
    }
  ],
  "post_processing": {
    "cadence": "Hold or drop frames to maintain 12 fps rhythm before final encode.",
    "jitter_px": [
      0.5,
      1.5
    ],
    "flicker": "Layer subtle 1.5% exposure oscillation and 150K color temperature drift per 12 frames.",
    "audio": "Blend brick clicks, servo whirs, restrained commentary, and night crowd murmur."
  },
  "quality": {
    "checks": [
      {
        "id": "pose_discipline",
        "description": "Limit per-frame minifig limb travel to maintain Lego stop-motion authenticity.",
        "tolerance": "<= 6 degrees per frame"
      },
      {
        "id": "stud_visibility",
        "description": "Ensure studs and mold seams remain legible in every hero frame.",
        "tolerance": ">= 80% frames"
      },
      {
        "id": "motion_stutter",
        "description": "Apply irregular frame holds to avoid CG smoothness and respect human jitter.",
        "tolerance": ">= 1 hold per 6 frames"
      },
      {
        "id": "lens_character",
        "description": "Apply vignette and focus breathing to each beat transition for tactile optics.",
        "tolerance": "applied per beat"
      }
    ]
  },
  "bindings": {
    "wrapper": "capsule.wrapper.adaptco_os.v1",
    "routing_policy": "capsule.gpt.intent.routing.v1",
    "lora_map": "capsule.boo.lora.map.v1",
    "registry": "capsule.registry.runtime.v1",
    "vault": "relay.artifacts.v1",
    "previz": "sol.f1.previz.v1"
  },
  "attestation": {
    "status": "STAGED",
    "sealed_at": null,
    "content_hash": null
  }
}
